{
  "$schema": "../../shared/schemas/harness-routing.schema.json",
  "version": 2,
  "roles": {
    "build": {
      "model": "openai/gpt-5.6-sol"
    },
    "planner": {
      "model": "openai/gpt-5.6-sol"
    },
    "plan-reviewer": {
      "families": {
        "family-1": {
          "model": "openai/gpt-5.6-sol",
          "primary": true,
          "optional": false,
          "countsLoop": true
        },
        "family-2": {
          "model": "ollama-cloud/kimi-k2.7-code",
          "primary": false,
          "optional": true,
          "countsLoop": false
        }
      }
    },
    "adversary": {
      "families": {
        "family-1": {
          "model": "openai/gpt-5.6-sol",
          "primary": true,
          "optional": false,
          "countsLoop": true
        },
        "family-2": {
          "model": "ollama-cloud/kimi-k2.7-code",
          "primary": false,
          "optional": true,
          "countsLoop": false
        }
      }
    },
    "compliance": {
      "model": "openai/gpt-5.5"
    },
    "security": {
      "model": "openai/gpt-5.5"
    },
    "executor": {
      "tiers": {
        "low": {
          "model": "ollama-cloud/gemma4:31b"
        },
        "medium": {
          "model": "ollama-cloud/glm-5.2"
        },
        "high": {
          "model": "ollama-cloud/kimi-k2.7-code"
        }
      }
    },
    "sniper": {
      "tiers": {
        "low": {
          "model": "ollama-cloud/gemma4:31b"
        },
        "medium": {
          "model": "ollama-cloud/glm-5.2"
        },
        "high": {
          "model": "ollama-cloud/kimi-k2.7-code"
        }
      }
    },
    "test-author": {
      "model": "ollama-cloud/glm-5.2"
    },
    "harvester": {
      "model": "openai/gpt-5.5"
    },
    "shipper": {
      "model": "openai/gpt-5.5"
    }
  },
  "constraints": {
    "crossFamilyRoles": [
      "plan-reviewer",
      "adversary"
    ],
    "requireDualOn": [
      "plan-reviewer",
      "adversary"
    ]
  },
  "modelCapabilities": {
    "openai/gpt-5.6-sol": {
      "supportsReasoningEffort": true
    },
    "openai/gpt-5.5": {
      "supportsReasoningEffort": true
    },
    "ollama-cloud/gemma4:31b": {
      "supportsReasoningEffort": false
    },
    "ollama-cloud/glm-5.2": {
      "supportsReasoningEffort": false
    },
    "ollama-cloud/kimi-k2.7-code": {
      "supportsReasoningEffort": false
    }
  }
}
